,number,value,datetime_start,datetime_complete,duration,params_bagging_temperature,params_bootstrap_type,params_colsample_bylevel,params_depth,params_l2_leaf_reg,params_learning_rate,params_min_data_in_leaf,params_od_type,params_od_wait,params_random_strength,params_subsample,state
172,172,0.2889111111111111,2025-06-26 14:07:39.000440,2025-06-26 14:09:03.076607,0 days 00:01:24.076167,0.000412248046356664,Bernoulli,0.5173429916119463,9,1.4292640576867988,0.010256624147040441,41,IncToDec,50,0.0034830512725191817,0.44005994146377586,COMPLETE
173,173,0.28729333333333334,2025-06-26 14:09:03.077384,2025-06-26 14:10:17.679229,0 days 00:01:14.601845,0.00023673478764289465,MVS,0.3901490989018817,10,1.1531668407526046,0.02268915744817791,68,IncToDec,31,0.11708457937424611,0.1752539308508413,COMPLETE
174,174,0.29035555555555553,2025-06-26 14:10:17.680266,2025-06-26 14:11:04.538905,0 days 00:00:46.858639,0.001478735480584917,MVS,0.36711763895159977,10,1.017503517076649,0.04574655662039907,78,Iter,49,0.29276115033123995,0.13396446683943186,COMPLETE
175,175,0.2873333333333333,2025-06-26 14:11:04.539746,2025-06-26 14:11:33.044071,0 days 00:00:28.504325,6.23224971124856e-05,Bayesian,0.3430097038296848,7,2.412814552651253,0.05428775859928438,91,Iter,27,0.41347771216739765,0.3304521139002097,COMPLETE
176,176,0.28950666666666663,2025-06-26 14:11:33.045052,2025-06-26 14:13:21.715777,0 days 00:01:48.670725,0.0004204690776011746,MVS,0.5468631564894055,10,1.159037443424923,0.02978836235258952,79,Iter,39,0.07884712191082141,0.09945488616762915,COMPLETE
177,177,0.2873866666666666,2025-06-26 14:13:21.716684,2025-06-26 14:13:38.563837,0 days 00:00:16.847153,0.00010607320041269782,Bayesian,0.42850489785961815,4,1.6125814287738298,0.10110011975499426,78,Iter,35,0.2266912575554832,0.08038159311874085,COMPLETE
178,178,0.2859688888888889,2025-06-26 14:13:38.564667,2025-06-26 14:14:09.637727,0 days 00:00:31.073060,0.00010346859719167692,Bernoulli,0.549686368861856,10,3.5984492620093316,0.18525640040643923,94,IncToDec,48,0.3860322827283832,0.3424592593926079,COMPLETE
179,179,0.2869644444444444,2025-06-26 14:14:09.638620,2025-06-26 14:14:32.258500,0 days 00:00:22.619880,8.701136575613293e-06,Bernoulli,0.39963987916924393,10,1.0959592115112382,0.16881599428669564,62,Iter,49,0.18313156702837646,0.28524625970640594,COMPLETE
180,180,0.28589777777777775,2025-06-26 14:14:32.259373,2025-06-26 14:15:31.998183,0 days 00:00:59.738810,2.6052688285988832e-05,MVS,0.6015348317690261,10,1.0780053017087703,0.05889841397737654,76,Iter,42,0.11430953222692179,0.13498817779600225,COMPLETE
181,181,0.28783999999999993,2025-06-26 14:15:31.999165,2025-06-26 14:16:20.350108,0 days 00:00:48.350943,2.4090447177253626e-05,Bernoulli,0.554577933096433,8,2.4240675895307575,0.022482380684927594,96,IncToDec,50,0.10746257829865441,0.5896822618944504,COMPLETE
182,182,0.28903999999999996,2025-06-26 14:16:20.351182,2025-06-26 14:17:28.057327,0 days 00:01:07.706145,4.4649640447745575,MVS,0.646631988295587,9,1.3688620602774102,0.0389510133939771,62,Iter,49,0.153583976061371,0.3933505364151709,COMPLETE
183,183,0.2877955555555555,2025-06-26 14:17:28.058253,2025-06-26 14:18:21.117883,0 days 00:00:53.059630,0.00637547273007008,MVS,0.4458331650398667,9,1.4268183751200465,0.04377386453082605,43,IncToDec,45,0.015212400033558022,0.24948222883440208,COMPLETE
184,184,0.28745777777777776,2025-06-26 14:18:21.118719,2025-06-26 14:18:32.999958,0 days 00:00:11.881239,6.516595178716132e-05,Bayesian,0.3170640704985369,7,2.2266774965175657,0.14942321136798523,100,Iter,25,0.16739502566202835,0.13409576304929102,COMPLETE
185,185,0.2873555555555556,2025-06-26 14:18:33.000809,2025-06-26 14:19:16.236245,0 days 00:00:43.235436,0.00015494194384181194,MVS,0.25260290960427734,10,1.056190791678878,0.02532599072382148,94,Iter,48,0.3796812878483006,0.11620520891661802,COMPLETE
186,186,0.2881244444444444,2025-06-26 14:19:16.237514,2025-06-26 14:21:00.963167,0 days 00:01:44.725653,1.6875505130339024e-07,Bernoulli,0.5183924943247437,10,1.7166512926938693,0.013979165121430197,44,Iter,49,0.053262479104850116,0.6254769240720793,COMPLETE
187,187,0.2863644444444444,2025-06-26 14:21:00.964112,2025-06-26 14:21:44.124576,0 days 00:00:43.160464,0.002462722652746886,Bernoulli,0.6611806999395033,9,1.0919178195014978,0.013552637014935672,50,IncToDec,44,0.28329670352011344,0.7237577795788266,COMPLETE
188,188,0.28612444444444446,2025-06-26 14:21:44.125604,2025-06-26 14:22:20.003692,0 days 00:00:35.878088,2.2310878729701527e-05,MVS,0.21419492054181513,10,1.2294826713821954,0.017648511432724015,43,Iter,48,0.28468655295839473,0.4441462794292809,COMPLETE
189,189,0.28824,2025-06-26 14:22:20.004838,2025-06-26 14:23:06.136271,0 days 00:00:46.131433,1.1885771474165921e-05,MVS,0.5325573844904814,10,2.336107928076391,0.10063297761820045,74,IncToDec,42,0.11519019280736316,0.33049294092670733,COMPLETE
190,190,0.2844044444444444,2025-06-26 14:23:06.137257,2025-06-26 14:23:40.129567,0 days 00:00:33.992310,0.0020043083721696907,Bayesian,0.5898787748752132,10,2.4799761083782186,0.21776497923104052,97,IncToDec,50,0.30454078744731,0.21901019847222508,COMPLETE
191,191,0.28520888888888885,2025-06-26 14:23:40.130343,2025-06-26 14:24:07.909938,0 days 00:00:27.779595,0.03989271456950016,Bernoulli,0.5076965729744969,6,2.7806379277969837,0.007092704396092792,94,Iter,39,0.2251213138147147,0.06460339456439251,COMPLETE
192,192,0.28735555555555553,2025-06-26 14:24:07.910774,2025-06-26 14:25:01.297470,0 days 00:00:53.386696,0.0016635164960379768,Bernoulli,0.4884138451582709,10,1.6898725695132393,0.04056589095890608,95,IncToDec,44,0.30984573958704736,0.46317129474984237,COMPLETE
193,193,0.2882711111111111,2025-06-26 14:25:01.298302,2025-06-26 14:25:59.235194,0 days 00:00:57.936892,9.313427476393512,Bayesian,0.38278620296790855,8,1.3222307596064529,0.007015418994419504,88,Iter,33,0.01727394031387279,0.1795231330757956,COMPLETE
194,194,0.28800888888888887,2025-06-26 14:25:59.236105,2025-06-26 14:27:01.750504,0 days 00:01:02.514399,1.2671912495213599e-05,Bernoulli,0.690431461087971,10,2.414783508073685,0.08851208217461244,95,IncToDec,49,0.038850678222327184,0.32411432418121255,COMPLETE
195,195,0.28832444444444444,2025-06-26 14:27:01.751311,2025-06-26 14:27:38.138441,0 days 00:00:36.387130,3.5766097641120744e-06,Bayesian,0.5576175369101765,9,1.592973559913995,0.07498718755827528,66,Iter,26,0.2032743384604323,0.1988725563752131,COMPLETE
196,196,0.28759111111111113,2025-06-26 14:27:38.139470,2025-06-26 14:27:54.009752,0 days 00:00:15.870282,0.06360203123677699,Bayesian,0.6783007982630462,5,1.6632041276186353,0.16568520176811358,66,Iter,16,0.3126139727889955,0.13253552395019846,COMPLETE
197,197,0.28583555555555556,2025-06-26 14:27:54.010538,2025-06-26 14:28:34.392272,0 days 00:00:40.381734,0.2680185866540847,Bernoulli,0.3099090989516032,9,1.3586427518694786,0.008028800711411373,56,IncToDec,42,0.17637195752423357,0.7553349899234714,COMPLETE
198,198,0.2903955555555555,2025-06-26 14:28:34.393168,2025-06-26 14:29:13.225096,0 days 00:00:38.831928,0.05348070534075387,MVS,0.46716859125872134,10,1.32155087200765,0.09549234266440819,85,IncToDec,38,0.026053398189976366,0.29019483388436895,COMPLETE
199,199,0.28709777777777773,2025-06-26 14:29:13.225955,2025-06-26 14:29:51.140403,0 days 00:00:37.914448,1.5229308037388207,MVS,0.32495814263630773,10,1.7317787561945877,0.060994223606300725,98,IncToDec,34,0.04841252354016268,0.24493485253409417,COMPLETE
